{
    "$schema": "https://json-schema.org/draft/2020-12/schema",
    "title": "Polaris Code Intelligence record v2",
    "type": "object",
    "required": [
        "record_version",
        "task_id",
        "work_item_revision",
        "stage",
        "artifact_attempt",
        "reviewer_slot",
        "provider",
        "target",
        "status",
        "queries",
        "status_check",
        "sync",
        "freshness",
        "source_fallbacks",
        "recorded_at"
    ],
    "additionalProperties": false,
    "properties": {
        "record_version": {
            "const": 2
        },
        "task_id": {
            "type": "string",
            "pattern": "^TASK-[0-9]{4}$"
        },
        "work_item_revision": {
            "type": "integer",
            "minimum": 1
        },
        "stage": {
            "type": "string",
            "enum": [
                "PLANNING",
                "IMPLEMENTATION",
                "DOCUMENTATION_SYNC",
                "REVIEW"
            ]
        },
        "artifact_attempt": {
            "type": [
                "integer",
                "null"
            ],
            "minimum": 1
        },
        "reviewer_slot": {
            "type": [
                "integer",
                "null"
            ],
            "minimum": 1
        },
        "provider": {
            "type": [
                "object",
                "null"
            ],
            "required": [
                "id",
                "descriptor_version",
                "transport",
                "available_operations"
            ],
            "additionalProperties": false,
            "properties": {
                "id": {
                    "type": "string",
                    "pattern": "^[a-z][a-z0-9-]*$"
                },
                "descriptor_version": {
                    "const": 2
                },
                "transport": {
                    "const": "mcp"
                },
                "available_operations": {
                    "type": "array",
                    "uniqueItems": true,
                    "items": {
                        "type": "string",
                        "enum": [
                            "explore",
                            "status",
                            "sync"
                        ]
                    }
                }
            }
        },
        "target": {
            "type": "object",
            "required": [
                "base_commit",
                "head_commit",
                "diff_hash"
            ],
            "additionalProperties": false,
            "properties": {
                "base_commit": {
                    "type": "string",
                    "pattern": "^[0-9a-f]{40}$"
                },
                "head_commit": {
                    "type": [
                        "string",
                        "null"
                    ],
                    "pattern": "^[0-9a-f]{40}$"
                },
                "diff_hash": {
                    "type": [
                        "string",
                        "null"
                    ],
                    "pattern": "^[0-9a-f]{64}$"
                }
            }
        },
        "status": {
            "type": "string",
            "enum": [
                "USED",
                "UNAVAILABLE",
                "FAILED",
                "SKIPPED"
            ]
        },
        "queries": {
            "type": "array",
            "items": {
                "type": "object",
                "required": [
                    "id",
                    "operation",
                    "purpose",
                    "status",
                    "summary",
                    "symbols",
                    "response_sha256",
                    "error"
                ],
                "additionalProperties": false,
                "properties": {
                    "id": {
                        "type": "string",
                        "pattern": "^CIQ-[0-9]{3}$"
                    },
                    "operation": {
                        "const": "explore"
                    },
                    "purpose": {
                        "type": "string",
                        "minLength": 1
                    },
                    "status": {
                        "type": "string",
                        "enum": [
                            "SUCCESS",
                            "EMPTY",
                            "FAILED",
                            "UNAVAILABLE"
                        ]
                    },
                    "summary": {
                        "type": "string"
                    },
                    "symbols": {
                        "type": "array",
                        "items": {
                            "type": "object",
                            "required": [
                                "path",
                                "line",
                                "name"
                            ],
                            "additionalProperties": false,
                            "properties": {
                                "path": {
                                    "type": "string",
                                    "minLength": 1
                                },
                                "line": {
                                    "type": [
                                        "integer",
                                        "null"
                                    ],
                                    "minimum": 1
                                },
                                "name": {
                                    "type": "string",
                                    "minLength": 1
                                }
                            }
                        }
                    },
                    "response_sha256": {
                        "type": [
                            "string",
                            "null"
                        ],
                        "pattern": "^[0-9a-f]{64}$"
                    },
                    "error": {
                        "type": [
                            "string",
                            "null"
                        ]
                    }
                }
            }
        },
        "status_check": {
            "type": [
                "object",
                "null"
            ],
            "required": [
                "status",
                "phase",
                "response_sha256",
                "error"
            ],
            "additionalProperties": false,
            "properties": {
                "status": {
                    "type": "string",
                    "enum": [
                        "SUCCESS",
                        "FAILED",
                        "SKIPPED",
                        "UNAVAILABLE"
                    ]
                },
                "phase": {
                    "type": "string",
                    "enum": [
                        "STAGE_ENTRY",
                        "POST_SYNC"
                    ]
                },
                "response_sha256": {
                    "type": [
                        "string",
                        "null"
                    ],
                    "pattern": "^[0-9a-f]{64}$"
                },
                "error": {
                    "type": [
                        "string",
                        "null"
                    ]
                }
            }
        },
        "sync": {
            "type": [
                "object",
                "null"
            ],
            "required": [
                "status",
                "response_sha256",
                "error"
            ],
            "additionalProperties": false,
            "properties": {
                "status": {
                    "type": "string",
                    "enum": [
                        "SUCCESS",
                        "FAILED",
                        "SKIPPED",
                        "UNAVAILABLE"
                    ]
                },
                "response_sha256": {
                    "type": [
                        "string",
                        "null"
                    ],
                    "pattern": "^[0-9a-f]{64}$"
                },
                "error": {
                    "type": [
                        "string",
                        "null"
                    ]
                }
            }
        },
        "freshness": {
            "type": "object",
            "required": [
                "status",
                "checked_at",
                "basis",
                "response_sha256",
                "stale_points"
            ],
            "additionalProperties": false,
            "properties": {
                "status": {
                    "type": "string",
                    "enum": [
                        "CURRENT_AT_CHECK",
                        "PARTIAL_STALE",
                        "INDEX_STALE",
                        "NOT_VERIFIED",
                        "UNAVAILABLE"
                    ]
                },
                "checked_at": {
                    "type": "string",
                    "minLength": 1
                },
                "response_sha256": {
                    "type": [
                        "string",
                        "null"
                    ],
                    "pattern": "^[0-9a-f]{64}$"
                },
                "basis": {
                    "type": "array",
                    "minItems": 1,
                    "uniqueItems": true,
                    "items": {
                        "type": "string",
                        "enum": [
                            "CONNECT_RECONCILIATION",
                            "STATUS_JSON",
                            "SYNC_ACKNOWLEDGED",
                            "RESPONSE_BANNER",
                            "NONE"
                        ]
                    }
                },
                "stale_points": {
                    "type": "array",
                    "items": {
                        "type": "object",
                        "required": [
                            "scope",
                            "path",
                            "reason",
                            "fallback",
                            "observed_sha256"
                        ],
                        "additionalProperties": false,
                        "properties": {
                            "scope": {
                                "type": "string",
                                "enum": [
                                    "FILE",
                                    "INDEX"
                                ]
                            },
                            "path": {
                                "type": [
                                    "string",
                                    "null"
                                ]
                            },
                            "reason": {
                                "type": "string",
                                "enum": [
                                    "PENDING_SYNC",
                                    "AUTO_SYNC_DISABLED",
                                    "WORKTREE_MISMATCH",
                                    "INDEX_PARTIAL",
                                    "INDEX_INDEXING",
                                    "INDEX_FAILED",
                                    "PENDING_REFERENCES",
                                    "REINDEX_RECOMMENDED",
                                    "SYNC_FAILED",
                                    "STATUS_UNREADABLE"
                                ]
                            },
                            "fallback": {
                                "type": "string",
                                "enum": [
                                    "READ_SOURCE",
                                    "INSPECT_GIT_DIFF",
                                    "SEARCH_SOURCE"
                                ]
                            },
                            "observed_sha256": {
                                "type": [
                                    "string",
                                    "null"
                                ],
                                "pattern": "^[0-9a-f]{64}$"
                            }
                        }
                    }
                }
            }
        },
        "source_fallbacks": {
            "type": "array",
            "items": {
                "type": "object",
                "required": [
                    "action",
                    "path",
                    "observed_sha256",
                    "base_commit",
                    "head_commit",
                    "diff_hash",
                    "purpose",
                    "result_paths"
                ],
                "additionalProperties": false,
                "properties": {
                    "action": {
                        "type": "string",
                        "enum": [
                            "READ_SOURCE",
                            "INSPECT_GIT_DIFF",
                            "SEARCH_SOURCE"
                        ]
                    },
                    "path": {
                        "type": [
                            "string",
                            "null"
                        ]
                    },
                    "observed_sha256": {
                        "type": [
                            "string",
                            "null"
                        ],
                        "pattern": "^[0-9a-f]{64}$"
                    },
                    "base_commit": {
                        "type": [
                            "string",
                            "null"
                        ],
                        "pattern": "^[0-9a-f]{40}$"
                    },
                    "head_commit": {
                        "type": [
                            "string",
                            "null"
                        ],
                        "pattern": "^[0-9a-f]{40}$"
                    },
                    "diff_hash": {
                        "type": [
                            "string",
                            "null"
                        ],
                        "pattern": "^[0-9a-f]{64}$"
                    },
                    "purpose": {
                        "type": "string"
                    },
                    "result_paths": {
                        "type": "array",
                        "maxItems": 100,
                        "items": {
                            "type": "object",
                            "required": [
                                "path",
                                "observed_sha256"
                            ],
                            "additionalProperties": false,
                            "properties": {
                                "path": {
                                    "type": "string",
                                    "minLength": 1
                                },
                                "observed_sha256": {
                                    "type": "string",
                                    "pattern": "^[0-9a-f]{64}$"
                                }
                            }
                        }
                    }
                }
            }
        },
        "recorded_at": {
            "type": "string",
            "minLength": 1
        }
    }
}
