{
    "record_version": 2,
    "task_id": "TASK-0001",
    "work_item_revision": 1,
    "stage": "PLANNING",
    "artifact_attempt": null,
    "reviewer_slot": null,
    "provider": null,
    "target": {
        "base_commit": "0000000000000000000000000000000000000000",
        "head_commit": null,
        "diff_hash": null
    },
    "status": "UNAVAILABLE",
    "queries": [],
    "status_check": null,
    "sync": null,
    "freshness": {
        "status": "UNAVAILABLE",
        "checked_at": "1970-01-01T00:00:00Z",
        "basis": [
            "NONE"
        ],
        "response_sha256": null,
        "stale_points": []
    },
    "source_fallbacks": [],
    "recorded_at": "1970-01-01T00:00:00Z"
}
